{
  "aggregates": {
    "dimensions": {
      "budget": [
        {
          "median_net_wall_time_ns": 909000,
          "median_peak_rss_bytes": 32001024,
          "outcomes": {
            "available": 3,
            "degraded": 3,
            "unavailable": 3
          },
          "sample_count": 9,
          "value": "broad"
        },
        {
          "median_net_wall_time_ns": 1109000,
          "median_peak_rss_bytes": 32001024,
          "outcomes": {
            "empty": 3,
            "partial": 3,
            "timeout": 3
          },
          "sample_count": 9,
          "value": "tight"
        }
      ],
      "corpus": [
        {
          "median_net_wall_time_ns": 509000,
          "median_peak_rss_bytes": 32001024,
          "outcomes": {
            "empty": 3
          },
          "sample_count": 3,
          "value": "empty-corpus"
        },
        {
          "median_net_wall_time_ns": 1109000,
          "median_peak_rss_bytes": 32001024,
          "outcomes": {
            "available": 3,
            "degraded": 3,
            "partial": 3,
            "timeout": 3,
            "unavailable": 3
          },
          "sample_count": 15,
          "value": "standard-corpus"
        }
      ],
      "outcome_status": [
        {
          "median_net_wall_time_ns": 909000,
          "median_peak_rss_bytes": 32001024,
          "outcomes": {
            "available": 3
          },
          "sample_count": 3,
          "value": "available"
        },
        {
          "median_net_wall_time_ns": 1409000,
          "median_peak_rss_bytes": 32001024,
          "outcomes": {
            "degraded": 3
          },
          "sample_count": 3,
          "value": "degraded"
        },
        {
          "median_net_wall_time_ns": 509000,
          "median_peak_rss_bytes": 32001024,
          "outcomes": {
            "empty": 3
          },
          "sample_count": 3,
          "value": "empty"
        },
        {
          "median_net_wall_time_ns": 1109000,
          "median_peak_rss_bytes": 32001024,
          "outcomes": {
            "partial": 3
          },
          "sample_count": 3,
          "value": "partial"
        },
        {
          "median_net_wall_time_ns": 49909000,
          "median_peak_rss_bytes": 32001024,
          "outcomes": {
            "timeout": 3
          },
          "sample_count": 3,
          "value": "timeout"
        },
        {
          "median_net_wall_time_ns": 209000,
          "median_peak_rss_bytes": 32001024,
          "outcomes": {
            "unavailable": 3
          },
          "sample_count": 3,
          "value": "unavailable"
        }
      ],
      "phase": [
        {
          "median_net_wall_time_ns": 509000,
          "median_peak_rss_bytes": 32001024,
          "outcomes": {
            "empty": 3,
            "timeout": 3,
            "unavailable": 3
          },
          "sample_count": 9,
          "value": "cold"
        },
        {
          "median_net_wall_time_ns": 1109000,
          "median_peak_rss_bytes": 32001024,
          "outcomes": {
            "available": 3,
            "degraded": 3,
            "partial": 3
          },
          "sample_count": 9,
          "value": "warm"
        }
      ],
      "profile": [
        {
          "median_net_wall_time_ns": 909000,
          "median_peak_rss_bytes": 32001024,
          "outcomes": {
            "available": 3,
            "empty": 3,
            "timeout": 3
          },
          "sample_count": 9,
          "value": "local-x86-offline"
        },
        {
          "median_net_wall_time_ns": 1109000,
          "median_peak_rss_bytes": 32001024,
          "outcomes": {
            "degraded": 3,
            "partial": 3,
            "unavailable": 3
          },
          "sample_count": 9,
          "value": "portable-edge-offline"
        }
      ]
    }
  },
  "benchmark": "edge-resource-envelope",
  "claims": {
    "label": "resource-envelope-observation",
    "low_swap_established": false,
    "partner_hardware_benchmarked": false,
    "power_inferred_from_cpu_or_memory": false,
    "product_efficacy": false
  },
  "commitments": {
    "driver_sha256": "289791312b201445b216f1306ccbd6fc7416f1d5a407203e9b673dd3d675cbd1",
    "harness_sha256": "e4f140901a8ae3a0e75865f0ef30d543b10d7f6689ed1ddbc5c934e0a8677d4c",
    "manifest_sha256": "3a54b85edaa804a986c6ba5e0df04651f128e74e42a54b8b616b70f661b1686e",
    "observations_sha256": "a7c0ed1d993217c81a7e0e366f572ebb7ecb8e23f888309173a6f678b5d1ffcd",
    "samples_sha256": "9222e9f4133e64917a7f75e89b8c103608a33e6b2e5bc1f786fc7cfea184b521"
  },
  "execution": {
    "answerer_calls": 0,
    "judge_calls": 0,
    "network_calls": 0,
    "offline": true,
    "provider_calls": 0
  },
  "manifest": {
    "benchmark_id": "issue-1105-contract-fixture-v1",
    "benchmark_version": "1.0.0",
    "budgets": [
      {
        "context_char_budget": 2048,
        "id": "broad",
        "recall_limit": 10,
        "traversal_depth": 1
      },
      {
        "context_char_budget": 512,
        "id": "tight",
        "recall_limit": 3,
        "traversal_depth": 0
      }
    ],
    "cases": [
      {
        "budget_id": "broad",
        "corpus_id": "standard-corpus",
        "expected_outcomes": [
          "available"
        ],
        "id": "available-warm",
        "phase": "warm",
        "profile_id": "local-x86-offline",
        "repetitions": 3,
        "scenario": "available"
      },
      {
        "budget_id": "broad",
        "corpus_id": "standard-corpus",
        "expected_outcomes": [
          "degraded"
        ],
        "id": "degraded-warm",
        "phase": "warm",
        "profile_id": "portable-edge-offline",
        "repetitions": 3,
        "scenario": "degraded"
      },
      {
        "budget_id": "tight",
        "corpus_id": "empty-corpus",
        "expected_outcomes": [
          "empty"
        ],
        "id": "empty-cold",
        "phase": "cold",
        "profile_id": "local-x86-offline",
        "repetitions": 3,
        "scenario": "empty"
      },
      {
        "budget_id": "tight",
        "corpus_id": "standard-corpus",
        "expected_outcomes": [
          "partial"
        ],
        "id": "partial-warm",
        "phase": "warm",
        "profile_id": "portable-edge-offline",
        "repetitions": 3,
        "scenario": "partial"
      },
      {
        "budget_id": "tight",
        "corpus_id": "standard-corpus",
        "expected_outcomes": [
          "timeout"
        ],
        "id": "timeout-cold",
        "phase": "cold",
        "profile_id": "local-x86-offline",
        "repetitions": 3,
        "scenario": "timeout"
      },
      {
        "budget_id": "broad",
        "corpus_id": "standard-corpus",
        "expected_outcomes": [
          "unavailable"
        ],
        "id": "unavailable-cold",
        "phase": "cold",
        "profile_id": "portable-edge-offline",
        "repetitions": 3,
        "scenario": "unavailable"
      }
    ],
    "corpora": [
      {
        "entity_count": 0,
        "fixture_sha256": "1bcf8b84a93ad81e23e370ea24dea8c3b3c19dfffc6e1b57cc8d3d83fe4cbffa",
        "id": "empty-corpus",
        "query_count": 1
      },
      {
        "entity_count": 64,
        "fixture_sha256": "ab93c4afec77559648535b85144115b18b17c8659501cb1865530eb7ca42d175",
        "id": "standard-corpus",
        "query_count": 8
      }
    ],
    "driver": {
      "id": "resource-envelope-fixture-driver-v1",
      "sha256": "289791312b201445b216f1306ccbd6fc7416f1d5a407203e9b673dd3d675cbd1"
    },
    "offline": true,
    "profiles": [
      {
        "backend_runtime_manifest": {
          "embedding_backend": "none",
          "model_backend": "none",
          "network": "disabled",
          "storage_backend": "sqlite-fts5"
        },
        "constraints": {
          "cpu_threads": 4,
          "memory_limit_mb": 4096
        },
        "deployment_profile": "offline",
        "hardware_class": "x86_64-local-baseline",
        "id": "local-x86-offline",
        "profile_digest": "a026fbb1b2e32ec612e6c8f1de21a4f3e58b580c3afe071a926bb3b85bfda0d3"
      },
      {
        "backend_runtime_manifest": {
          "embedding_backend": "none",
          "model_backend": "none",
          "network": "disabled",
          "storage_backend": "sqlite-fts5"
        },
        "constraints": {
          "cpu_threads": 2,
          "memory_limit_mb": 1024
        },
        "deployment_profile": "offline",
        "hardware_class": "portable-constrained-edge",
        "id": "portable-edge-offline",
        "profile_digest": "80a117ad8af7fe1570231ca63ca25d329a53913277e5627a0ac09fc77c5513b4"
      }
    ],
    "schema_version": "perseus-vault-resource-envelope-manifest/v1",
    "seed": 1105,
    "tolerances": {
      "minimum_repetitions": 3,
      "relative_spread_max": 0.25
    },
    "vault_revision": "2ac619b22db1fe2feef7b51386c7394189e5ccb9"
  },
  "report_sha256": "c4425186617b9ee70b31abc069eb2455f398cd5a33a63e56dd7126020a77847e",
  "reproducibility": {
    "evaluated_groups": 6,
    "groups": [
      {
        "case_id": "available-warm",
        "median_net_wall_time_ns": 909000,
        "relative_spread": 0.019802,
        "repetitions": 3,
        "status": "within_tolerance",
        "tolerance": 0.25
      },
      {
        "case_id": "degraded-warm",
        "median_net_wall_time_ns": 1409000,
        "relative_spread": 0.012775,
        "repetitions": 3,
        "status": "within_tolerance",
        "tolerance": 0.25
      },
      {
        "case_id": "empty-cold",
        "median_net_wall_time_ns": 509000,
        "relative_spread": 0.035363,
        "repetitions": 3,
        "status": "within_tolerance",
        "tolerance": 0.25
      },
      {
        "case_id": "partial-warm",
        "median_net_wall_time_ns": 1109000,
        "relative_spread": 0.016231,
        "repetitions": 3,
        "status": "within_tolerance",